{
  "schema_version": 1,
  "release": "OpenITI-2025.1.9-cfc4157a",
  "release_date": "2025-12-30",
  "release_uri": "https://github.com/OpenITI/RELEASE/tree/cfc4157a3cf2054c0888f133970a4eaa3e22e58c",
  "release_doi": "10.5281/zenodo.17767721",
  "content_kind": "approved_corpus",
  "license": {
    "id": "CC-BY-NC-SA-4.0",
    "uri": "https://creativecommons.org/licenses/by-nc-sa/4.0/"
  },
  "attribution": "OpenITI corpus release v2025.1.9, produced by the Open Islamicate Texts Initiative (OpenITI/KITAB); individual files and upstream editions retain their recorded provenance.",
  "approval": {
    "status": "local_only_licence_reviewed",
    "reference": "Local non-commercial research use under CC BY-NC-SA 4.0; corpus text and the derived SQLite index are not distributed or baked into the public image."
  },
  "source_root_env": "TAKHRIJ_LOCAL_CORPUS_ROOT",
  "documents": [
    {
      "doc_id": "0276IbnQutaybaDinawari.AdabKatib.Shamela0026349-ara1",
      "work_id": "0276IbnQutaybaDinawari.AdabKatib",
      "title": "Adab al-Katib",
      "author": "Ibn Qutayba al-Dinawari",
      "path": "data/0276IbnQutaybaDinawari/0276IbnQutaybaDinawari.AdabKatib/0276IbnQutaybaDinawari.AdabKatib.Shamela0026349-ara1",
      "source_uri": "https://github.com/OpenITI/RELEASE/blob/cfc4157a3cf2054c0888f133970a4eaa3e22e58c/data/0276IbnQutaybaDinawari/0276IbnQutaybaDinawari.AdabKatib/0276IbnQutaybaDinawari.AdabKatib.Shamela0026349-ara1",
      "source_sha256": "b068d59c6798c14cf54b5b81b78c0ad7eca8b0a8cd6a24229468714392187900",
      "source_format": "openiti_mARkdown",
      "language": "ara",
      "calendar": "AH",
      "selection_reason": "Early-side control at 276 AH; Shamela source family.",
      "provenance": {
        "metadata_source_uri": "https://github.com/OpenITI/RELEASE/tree/cfc4157a3cf2054c0888f133970a4eaa3e22e58c/data/0276IbnQutaybaDinawari",
        "author_death_year_ah": 276,
        "author_date_source_uri": "https://openiti.org/documentation/URIs.html#author",
        "composition_date_ah": null,
        "composition_date_source_uri": null,
        "edition_citation": null,
        "edition_date": null,
        "edition_source_uri": null,
        "witness_description": null,
        "witness_date": null,
        "witness_source_uri": null,
        "quality_status": "pri",
        "quality_notes": "Pinned primary Arabic text (-ara1); date is the AuthorID death-year field, not a composition date."
      }
    },
    {
      "doc_id": "0414AbuHayyanTawhidi.AkhlaqWazirayn.Shamela0012541-ara1",
      "work_id": "0414AbuHayyanTawhidi.AkhlaqWazirayn",
      "title": "Akhlaq al-Wazirayn",
      "author": "Abu Hayyan al-Tawhidi",
      "path": "data/0414AbuHayyanTawhidi/0414AbuHayyanTawhidi.AkhlaqWazirayn/0414AbuHayyanTawhidi.AkhlaqWazirayn.Shamela0012541-ara1",
      "source_uri": "https://github.com/OpenITI/RELEASE/blob/cfc4157a3cf2054c0888f133970a4eaa3e22e58c/data/0414AbuHayyanTawhidi/0414AbuHayyanTawhidi.AkhlaqWazirayn/0414AbuHayyanTawhidi.AkhlaqWazirayn.Shamela0012541-ara1",
      "source_sha256": "996102b46d232e816b8febfce89823110bbebf84bf506bc16736792d51c6ec67",
      "source_format": "openiti_mARkdown",
      "language": "ara",
      "calendar": "AH",
      "selection_reason": "Pre-cutoff control at 414 AH; Shamela source family.",
      "provenance": {
        "metadata_source_uri": "https://github.com/OpenITI/RELEASE/tree/cfc4157a3cf2054c0888f133970a4eaa3e22e58c/data/0414AbuHayyanTawhidi",
        "author_death_year_ah": 414,
        "author_date_source_uri": "https://openiti.org/documentation/URIs.html#author",
        "composition_date_ah": null,
        "composition_date_source_uri": null,
        "edition_citation": null,
        "edition_date": null,
        "edition_source_uri": null,
        "witness_description": null,
        "witness_date": null,
        "witness_source_uri": null,
        "quality_status": "pri",
        "quality_notes": "Pinned primary Arabic text (-ara1); date is the AuthorID death-year field, not a composition date."
      }
    },
    {
      "doc_id": "0456IbnHazm.TawqHamama.Shamela0010518-ara1",
      "work_id": "0456IbnHazm.TawqHamama",
      "title": "Tawq al-Hamama",
      "author": "Ibn Hazm",
      "path": "data/0456IbnHazm/0456IbnHazm.TawqHamama/0456IbnHazm.TawqHamama.Shamela0010518-ara1",
      "source_uri": "https://github.com/OpenITI/RELEASE/blob/cfc4157a3cf2054c0888f133970a4eaa3e22e58c/data/0456IbnHazm/0456IbnHazm.TawqHamama/0456IbnHazm.TawqHamama.Shamela0010518-ara1",
      "source_sha256": "9e6b74059a337a5edae76c3a09172d51a06045ab21febec85c83a59acce1df60",
      "source_format": "openiti_mARkdown",
      "language": "ara",
      "calendar": "AH",
      "selection_reason": "Near-cutoff control at 456 AH; Shamela source family.",
      "provenance": {
        "metadata_source_uri": "https://github.com/OpenITI/RELEASE/tree/cfc4157a3cf2054c0888f133970a4eaa3e22e58c/data/0456IbnHazm",
        "author_death_year_ah": 456,
        "author_date_source_uri": "https://openiti.org/documentation/URIs.html#author",
        "composition_date_ah": null,
        "composition_date_source_uri": null,
        "edition_citation": null,
        "edition_date": null,
        "edition_source_uri": null,
        "witness_description": null,
        "witness_date": null,
        "witness_source_uri": null,
        "quality_status": "pri",
        "quality_notes": "Pinned primary Arabic text (-ara1); date is the AuthorID death-year field, not a composition date."
      }
    },
    {
      "doc_id": "0505Ghazali.Munqidh.JK009330-ara1",
      "work_id": "0505Ghazali.Munqidh",
      "title": "al-Munqidh min al-Dalal",
      "author": "al-Ghazali",
      "path": "data/0505Ghazali/0505Ghazali.Munqidh/0505Ghazali.Munqidh.JK009330-ara1",
      "source_uri": "https://github.com/OpenITI/RELEASE/blob/cfc4157a3cf2054c0888f133970a4eaa3e22e58c/data/0505Ghazali/0505Ghazali.Munqidh/0505Ghazali.Munqidh.JK009330-ara1",
      "source_sha256": "f838132fadafa596be21e9a56d1c07501390d2ad4720af5e8f8c50623c683865",
      "source_format": "openiti_mARkdown",
      "language": "ara",
      "calendar": "AH",
      "selection_reason": "Immediate post-cutoff control at 505 AH; JK source family and primary status.",
      "provenance": {
        "metadata_source_uri": "https://github.com/OpenITI/RELEASE/tree/cfc4157a3cf2054c0888f133970a4eaa3e22e58c/data/0505Ghazali",
        "author_death_year_ah": 505,
        "author_date_source_uri": "https://openiti.org/documentation/URIs.html#author",
        "composition_date_ah": null,
        "composition_date_source_uri": null,
        "edition_citation": null,
        "edition_date": null,
        "edition_source_uri": null,
        "witness_description": null,
        "witness_date": null,
        "witness_source_uri": null,
        "quality_status": "pri",
        "quality_notes": "Pinned JK primary Arabic text (-ara1); the former Shamela candidate was sec and is intentionally excluded."
      }
    },
    {
      "doc_id": "0598IbnIdrisHilli.MustatrafatSarair.Shia001352-ara1",
      "work_id": "0598IbnIdrisHilli.MustatrafatSarair",
      "title": "Mustatrafat al-Sara'ir",
      "author": "Ibn Idris al-Hilli",
      "path": "data/0598IbnIdrisHilli/0598IbnIdrisHilli.MustatrafatSarair/0598IbnIdrisHilli.MustatrafatSarair.Shia001352-ara1",
      "source_uri": "https://github.com/OpenITI/RELEASE/blob/cfc4157a3cf2054c0888f133970a4eaa3e22e58c/data/0598IbnIdrisHilli/0598IbnIdrisHilli.MustatrafatSarair/0598IbnIdrisHilli.MustatrafatSarair.Shia001352-ara1",
      "source_sha256": "eed82053bcfc66847cf2c5d5b783f81cc6a60daa4ce4189bf91e07fbc35688ff",
      "source_format": "openiti_mARkdown",
      "language": "ara",
      "calendar": "AH",
      "selection_reason": "Later post-cutoff control at 598 AH; Shia source family.",
      "provenance": {
        "metadata_source_uri": "https://github.com/OpenITI/RELEASE/tree/cfc4157a3cf2054c0888f133970a4eaa3e22e58c/data/0598IbnIdrisHilli",
        "author_death_year_ah": 598,
        "author_date_source_uri": "https://openiti.org/documentation/URIs.html#author",
        "composition_date_ah": null,
        "composition_date_source_uri": null,
        "edition_citation": null,
        "edition_date": null,
        "edition_source_uri": null,
        "witness_description": null,
        "witness_date": null,
        "witness_source_uri": null,
        "quality_status": "pri",
        "quality_notes": "Pinned primary Arabic text (-ara1); date is the AuthorID death-year field, not a composition date."
      }
    }
  ]
}
